role_title,employer,employment_type,region,skills_count,soc_code,soc_title,soc_source,notes
Mechanical Assistant Project Manager,Power Design,Full-Time,"Pinellas County, FL",5,13-1082,Project Management Specialists,https://www.onetonline.org/link/summary/13-1082.00,Mechanical PM roles mapped to Project Management Specialists per O*NET; aligns with our internal doc.
Senior Financial Analyst (FP&A),TD SYNNEX,Full-Time,"Pinellas County, FL",8,13-2051,Financial and Investment Analysts,https://www.onetonline.org/link/summary/13-2051.00,
Mechanical Project Manager,Power Design,Full-Time,"Pinellas County, FL",5,13-1082,Project Management Specialists,https://www.onetonline.org/link/summary/13-1082.00,"Role details page shows St. Petersburg, FL; left location at region level for consistency."
Surgical Technologist (Certified),BayCare,Full-Time,"Pinellas County, FL",6,29-2055,Surgical Technologists,https://www.onetonline.org/link/summary/29-2055.00,
Business Development Manager,TECO,Full-Time,"Pinellas County, FL",8,11-2022,Sales Managers,https://www.onetonline.org/find/score/11-2022.00?s=business+development+manager,O*NET lists 'Business Development Manager' as an alternate title under Sales Managers (11-2022).
Administrative Assistant,Raymond James,Full-Time,"Pinellas County, FL",5,43-6014,"Secretaries and Administrative Assistants, Except Legal, Medical, and Executive",https://www.onetonline.org/link/summary/43-6014.00,
"Supervisor, Residential Inbound Sales",Spectrum,Full-Time,"Pinellas County, FL",6,41-1012,First-Line Supervisors of Non-Retail Sales Workers,https://www.onetonline.org/link/summary/41-1012.00,
Senior Mechanical Project Manager,Power Design,Full-Time,"Pinellas County, FL",8,13-1082,Project Management Specialists,https://www.onetonline.org/link/summary/13-1082.00,
